[
  {
    "id": "event_first_market_month",
    "title": "市集初行",
    "category": "Life",
    "location_id": "loc_qiandeng_town",
    "choices": [
      {
        "id": "observe",
        "text": "遠遠觀察人情買賣",
        "feedback": "你記住了市井中人的語氣與眼色。",
        "outcomes": {"memory": "market_observed", "emotion": {"curiosity": 8}}
      },
      {
        "id": "help_vendor",
        "text": "幫老販推車避雨",
        "feedback": "老人沒有多謝，只塞給你一枚溫熱銅錢。",
        "outcomes": {"wealth": 1, "relationship": {"trust": 3}}
      },
      {
        "id": "follow_swordsman",
        "text": "跟上戴笠劍客",
        "feedback": "你追到巷口，只見牆上多了一道新鮮劍痕。",
        "outcomes": {"rumor": "thin_sword_mark", "chance": "奇遇線索"}
      }
    ]
  }
]
